word,wordURL,meaning_1,sentence_1,meaning_2,sentence_2,meaning_3,sentence_3,way_to_remember,way_to_remember2,difficulty
creditable,"https://gre.magoosh.com/flashcards/vocabulary/basic-words-7/creditable#back,",adjective: deserving of praise but not that amazing,"Critics agreed the movie was creditable, but few gave it more than three out of five stars.",None,None,None,None,None,None,BASIC
enumerate,"https://gre.magoosh.com/flashcards/vocabulary/basic-words-7/enumerate#back,",verb: determine the number or amount of,The survey enumerates the number of happy workers and the number of unhappy workers.,"verb: specify individually, one by one",I sat and listened as she enumerated all of the things she did not like about the past three months.,None,None,ENUMERATE; NUMBER + IT means COUNT,in enumerate we have numerate like numeral which is a number so we make a list of one thing after the other in points or numbers,BASIC
amply,"https://gre.magoosh.com/flashcards/vocabulary/basic-words-7/amply#back,",adverb: more than is adequate,The boat was amply supplied for its year at sea—no man would go hungry or thirsty.,None,None,None,None,None,None,BASIC
besiege,"https://gre.magoosh.com/flashcards/vocabulary/basic-words-7/besiege#back,","verb: harass, as with questions or requests; cause to feel distressed or worried","After discovering a priceless artifact in her backyard, Jane was besieged by phone calls, emails, and reporters all trying to buy, hold or see the rare piece of history.",None,None,None,None,"divide it like-->be+siege(seize)-- Indian army has seized the line of control, and now the whole area is surrounded by armed forces.",be + seize = u are seized by armed forces / by some1 who is continiously annoying u ..!!,BASIC
decimation,"https://gre.magoosh.com/flashcards/vocabulary/basic-words-7/decimation#back,",noun: destroying or killing a large part of the population,The decimation after atomic bombs were dropped on Hiroshima and Nagasaki is incomprehensible.,None,None,None,None,None,None,BASIC
differentiate,"https://gre.magoosh.com/flashcards/vocabulary/basic-words-7/differentiate#back,","verb: be a distinctive feature, attribute, or trait (sometimes in positive sense)",Mozart's long melodic lines differentiate his compositions from other works of late 18th century music.,verb: evolve so as to lead to a new species or develop in a way most suited to the environment,Animals on Madagascar differentiated from other similar animal species due to many years of isolation on the island.,None,None,None,None,BASIC
inarticulate,"https://gre.magoosh.com/flashcards/vocabulary/basic-words-7/inarticulate#back,",adjective: without or deprived of the use of speech or words,"Although a brilliant economist, Professor Black was completely inarticulate, a terrible lecturer.",None,None,None,None,jis ki baton ma artificialness nazar aye...uski speach achi nai hoti,"""articulate"" rhymed with particular == ie his speech was not going in a particular direction so , he remained speechless , or started producing indistinct speech",BASIC
sordid,"https://gre.magoosh.com/flashcards/vocabulary/basic-words-7/sordid#back,",adjective: involving ignoble actions and motives; arousing moral distaste and contempt; foul and run-down and repulsive,"The nightly news simply announced that the senator had had an affair, but the tabloid published all the sordid details of the interaction.",None,None,None,None,"(SORDID)SORry I DID this FILTHY, VILE thing.",sour+dEEd =sordid,BASIC
vanquish,"https://gre.magoosh.com/flashcards/vocabulary/basic-words-7/vanquish#back,","verb: come out better in a competition, race, or conflict","For years, Argentina would dominate in World Cup qualifying matches, only to be vanquished by one of the European countries during the late stages of the tournament.",None,None,None,None,sounds like vanish..by vanishing u can be better than ny1 in a competition!!,if you want to defeat your enemy in race or exam CRUSH him with your VAN,BASIC
excruciating,"https://gre.magoosh.com/flashcards/vocabulary/basic-words-7/excruciating#back,",adjective: extremely painful,"After the boulder rolled a couple of feet, pinning my friend's arm, he experienced excruciating pain.",None,None,None,None,My ex-screwed me.....its extremely painful,crucial state of pain...,BASIC
boorish,"https://gre.magoosh.com/flashcards/vocabulary/basic-words-7/boorish#back,",adjective: ill-mannered and coarse or contemptible in behavior or appearance,Bukowski was known for being a boorish drunk and alienating close friends and family.,None,None,None,None,boor means =bura .... ill mannered... so make adj boorish..!..:),every one sounds BOO towards RUDE and INSENSITIVE persons,BASIC
balk,"https://gre.magoosh.com/flashcards/vocabulary/basic-words-7/balk#back,",verb: refuse to comply,"The students were willing to clean up the broken glass, but when the teacher asked them to mop the entire floor, they balked, citing reasons why they needed to leave.",None,None,None,None,sound close to bulk...when u see a bulky thing on ur way u refuse to go ahead,"When a dog barks, you balk.",BASIC
vie,"https://gre.magoosh.com/flashcards/vocabulary/basic-words-7/vie#back,",verb: compete for something,"While the other teams in the division actively vie for the championship, this team seems content simply to go through the motions of playing.",None,None,None,None,Pronounce it as 'Why' and observe the gesture i.e; right thumb up asking someone the question ' Why'.. and indeed you show your thumb up whenever you CHALLENGE some person,"vie sounds like ""SYE"", which means the challenge nothing but competing.",BASIC
futile,"https://gre.magoosh.com/flashcards/vocabulary/basic-words-7/futile#back,",adjective: producing no result or effect; unproductive of success,"I thought I could repair the car myself, but after two days of work with no success, I have to admit that my efforts were futile.",None,None,None,None,futile is not fertile.. hence not fruitful,futile sounds like foot oil ..spending 1000$ on foot oil is  WASTE..and UNPRODUCTIVE bcoz even then hair will not grow on your foot ..haha seems funny but works..,BASIC
complementary,"https://gre.magoosh.com/flashcards/vocabulary/basic-words-7/complementary#back,",adjective: enhancing each other's qualities (for two things or more).,"The head waiter was careful to tell the amateur diners that red wine was complementary with beef, each bringing out subtle taste notes in the other.",None,None,None,None,Husband and Wife are complementary ie. they both try to make life complement,None,BASIC
discreet,"https://gre.magoosh.com/flashcards/vocabulary/basic-words-7/discreet#back,",adjective: careful to protect one's speech or actions in order to avoid offense or draw attention,"The professor thought that he was discreet, subtly wiping the stain off of his shirt, but as soon as he stepped off the podium a heckler in the audience burst out, ""You missed a spot"".",None,None,None,None,"discreet-> diSECRET. ""You must be discreet about our SECRET.""",None,BASIC
misogynist,"https://gre.magoosh.com/flashcards/vocabulary/basic-words-7/misogynist#back,",noun: a person who dislikes women in particular,"Many have accused Hemingway of being a quiet misogynist, but recently unearthed letters argue against this belief.",None,None,None,None,"mis=to hate, and gyne=female as in gyneocologist","gyna is related to women...just like gynocologist....""gyna"" is formed from ""vagina"". i suppose",BASIC
obliging,"https://gre.magoosh.com/flashcards/vocabulary/basic-words-7/obliging#back,",adjective: showing a cheerful willingness to do favors for others,"Even after all his success, I found him to be accommodating and obliging, sharing with me his ""secret tips"" on how to gain wealth and make friends.",None,None,None,None,None,None,BASIC
colossal,"https://gre.magoosh.com/flashcards/vocabulary/basic-words-7/colossal#back,",adjective: so great in size or force or extent as to elicit awe,"Few appreciate the colossal scale of the sun: if hollow, it could contain a million Earths.",None,None,None,None,"remember the colosseum - one of the seven wonders of the world, which was a huge theatre in the olden days",Its huge loss,BASIC
paradoxical,"https://gre.magoosh.com/flashcards/vocabulary/basic-words-7/paradoxical#back,",adjective: seemingly contradictory but nonetheless possibly true,"That light could be both a particle and a wave seems paradoxical, but nonetheless, it is true.",None,None,None,None,None,None,BASIC
dilapidated,"https://gre.magoosh.com/flashcards/vocabulary/basic-words-7/dilapidated#back,",adjective: in terrible condition,The main house has been restored but the gazebo is still dilapidated and unusable.,None,None,None,None,I drank a DILuted API(appy) juice which was outDATED(expired).... my stomach got RUINED as a result of my own NEGLECT.,"dilapidate=daily+update
if u wont update ur antivirus daily ur sys will be ruined due to negligence",BASIC
qualm,"https://gre.magoosh.com/flashcards/vocabulary/basic-words-7/qualm#back,",noun: uneasiness about the fitness of an action,"While he could articulate no clear reason why Harkner's plan would fail, he nevertheless felt qualms about committing any resources to it.",None,None,None,None,opposite of Calm,"QUALM = QUAL + M(S) = QUALIFICATION + MS, you are in doubt whether MS as qualification is right for you or not.",BASIC
convivial,"https://gre.magoosh.com/flashcards/vocabulary/basic-words-7/convivial#back,",adjective: describing a lively atmosphere,The wedding reception was convivial; friends who hadn't seen each other for ages drank and ate together before heading to the dance floor.,None,None,None,None,"somewhat close to carnival
which also implies festivity.","con(together)vivi(bibi,wife) so if wife is with you,everything would be joyous",BASIC
Magoosh Score Guarantee,"https://gre.magoosh.com/flashcards/vocabulary/basic-words-7/magoosh-score-guarantee#back,",noun: Magoosh guarantees a 5 point increase in your score if you've taken the GRE before. Learn more at http://gre.magoosh.com,"With Magoosh, Josh was able to increase his GRE score by 7 points and didn't need to take advantage of the Magoosh score guarantee.",None,None,None,None,None,None,BASIC
voracious,"https://gre.magoosh.com/flashcards/vocabulary/basic-words-i/voracious#back,",adjective: very hungry; approaching an activity with gusto,"Steven was a voracious reader, sometimes finishing two novels in the same day.",None,None,None,None,"remember carniVORES ,herbiVORES...So ""VORE"" tells sumthing about eating.","Voracious (BORA RICE FOR US)

Imagine you are seeking a BORA BHARKAR RICE for yourself.. what does it signifies? Simply you be such a food craver !!",BASIC
unnerve,"https://gre.magoosh.com/flashcards/vocabulary/basic-words-i/unnerve#back,",verb: to make nervous or upset,"At one time unnerved by math problems, she began avidly “Magoosh-ing”, and soon became adept at even combinations and permutations questions.",None,None,None,None,UN (NO) NERVE (Muscle) : do not use muscle body..stoping from using something which is beneficial to u,None,BASIC
affable,"https://gre.magoosh.com/flashcards/vocabulary/basic-words-i/affable#back,",adjective: likeable; easy to talk to,"For all his surface affability, Marco was remarkably glum when he wasn’t around other people.",None,None,None,None,affection+able=affection to others,"affable= f + able, => that the teacher is able to give f grade to the students , so students are always trying to maintain a warm n healthy relation with the teachers, n also students always approaches their teachers.",BASIC
reprobate,"https://gre.magoosh.com/flashcards/vocabulary/basic-words-i/reprobate#back,",noun: a person without morals who is disapproved of,"Mr. Smith’s two boys couldn’t be more different; one was a hard-working and principled, the other was the town reprobate, always having run-ins with the law.",None,None,None,None,reprobate: rep(repeatedly)+rob+ate.. a person who again and again robs other peoples food and eats it up has no moral values.,reprobate is a person who has no probity,BASIC
inundate,"https://gre.magoosh.com/flashcards/vocabulary/basic-words-i/inundate#back,",verb: to flood or overwhelm,The newsroom was inundated with false reports that only made it more difficult for the newscasters to provide an objective account of the bank robbery.,None,None,None,None,I+NUN +DATE....I asked the NUNs for a DATE and i was FLOODED with letters from christian societies for violating the social norms.,"sounds like ""KIRAN DATE""
shahrukh ask kkkkkkiran for a date,
she replied with flood of ssssslaps...",BASIC
diabolical,"https://gre.magoosh.com/flashcards/vocabulary/basic-words-i/diabolical#back,",adjective: to be extremely wicked like the devil,"The conspirators, willing to dispatch anyone who stood in their way, hatched a diabolical plan to take over the city.",None,None,None,None,di + aboli(abolition)....process of destroying something usually done by devils,DAI(midwife)+BOLI(spoke)-  DAI at the time of birth BOLI that kid is going to be very DIABOLICAL(wicked).,BASIC
slapdash,"https://gre.magoosh.com/flashcards/vocabulary/basic-words-i/slapdash#back,",adjective: carelessly and hastily put together,"The office building had been constructed in a slapdash manner, so it did not surprise officials when, during a small earthquake, a large crack emerged on the façade of the building.",None,None,None,None,SLAPD(slapped)+ASH..SALMAN GOT SLAPPED BY ASH FOR HIS SLOPPY BEHAVIOUR ON THE SETS.,Sounds like (SLAP + DESH) : What kind of people will be ready to slap their Desh (Country).. ??? People who dnt feel it important to care for their country... So Slapdash means a rough careless slap on the NATION !!!!!,BASIC
censor,"https://gre.magoosh.com/flashcards/vocabulary/basic-words-i/censor#back,",verb: to examine and remove objectionable material,"Every fall, high school English teachers are inundated by requests to censor their curriculum by removing The Catcher in the Rye and Scarlet Letter from their reading lists.",noun: an official who censors material,The censor insisted that every reference to drugs should be removed from the manuscript.,None,None,censor board which removes inappropriate matters from movies,"relate censor to parents who eliminate inapproriate things for their children,censorship...",BASIC
zenith,"https://gre.magoosh.com/flashcards/vocabulary/basic-words-i/zenith#back,",noun: the highest point; culmination,"At the zenith of his artistic career, Elvis was outselling any other artist on the charts.",None,None,None,None,Word sounds like 'Jannat' which is in highest point,there is a popluar comoputer parts brand named as zeneath that considers itself as one of teh top sellers of computer spare parts,BASIC
hound,"https://gre.magoosh.com/flashcards/vocabulary/basic-words-i/hound#back,",verb: to pursue relentlessly,"An implacable foe of corruption, Eliot Ness hounded out graft in all forms—he even helped nab Al Capone.",None,None,None,None,None,None,BASIC
dupe,"https://gre.magoosh.com/flashcards/vocabulary/basic-words-i/dupe#back,",verb: to trick or swindle,"Once again a get-rich-fast Internet scheme had duped Harold into submitting a $5,000 check to a sham operation.",noun: a person who is easily tricked or swindled,"The charlatan mistook the crowd for a bunch of dupes, but the crowd was quickly on to him and decried his bald-faced attempt to bilk them.",None,None,duplicates(in movies) are used to fool people....,"DUPE sounds like dope means so ""to impure something"", means to cheat someone....",BASIC
macabre,"https://gre.magoosh.com/flashcards/vocabulary/basic-words-i/macabre#back,",adjective: suggesting the horror of death and decay; gruesome,Edgar Allen Poe was considered the master of the macabre; his stories vividly describe the moment leading up to—and often those moments after—a grisly death.,None,None,None,None,sounds like hindi word makbara....and its made over the place where people are either buried or burnt.....and for me its a ghastly place..that I would never like to go to....,"Sounds like massacre..which means ""excessive killing of many people""..and which also represents death",BASIC
serendipity,"https://gre.magoosh.com/flashcards/vocabulary/basic-words-i/serendipity#back,","noun: the instance in which an accidental, fortunate discovery is made","By pure serendipity, Sarah discovered, at a flea market in Peoria, a matching earring to replace the one that fell down the storm drain back home.",None,None,None,None,"if a DEITY shows PITY on you, you are LUCKY and you can DISCOVER GREAT THINGS.Serendipity=sudden+pity(divine)",Watch Serendipity movie & you will always remember this word.,BASIC
demure,"https://gre.magoosh.com/flashcards/vocabulary/basic-words-i/demure#back,",adjective: to be modest and shy,The portrait of her in a simple white blouse was sweet and demure.,None,None,None,None,"demur is the one who objects; demure is who doest not object, who is reserved and shy","Demure(adjective) is for a shy or modest person

Demur (verb) is to voice opposition..[which in a sense is not something a shy person will do'

Adding 'e' makes question raising person shy and modest.",BASIC
screed,"https://gre.magoosh.com/flashcards/vocabulary/basic-words-i/screed#back,",noun: an abusive rant (often tedious),"Joey had difficulty hanging out with his former best friend Perry, who, during his entire cup of coffee, enumerated all of the government’s deficiencies--only to break ranks and launch into some screed against big business.",None,None,None,None,screed sc is going to red i.e. totally tired due to labor in sun.,None,BASIC
pinnacle,"https://gre.magoosh.com/flashcards/vocabulary/basic-words-i/pinnacle#back,",noun: the highest point,"At its pinnacle, the Roman Empire extended across most of the landmass of Eurasia, a feat not paralleled to the rise of the British Empire in the 18th and 19th century.",None,None,None,None,pin(PINE TREE)+NACLE..SOUNDS LIKE UNCLE..so your uncle wants to CLIMB the PEAK  OR HIGHEST POINT OF PINE TREE.,"pinnacle:- ""Pina + ekkali"" to reach peak",BASIC
inflammatory,"https://gre.magoosh.com/flashcards/vocabulary/basic-words-i/inflammatory#back,","adjective: extremely controversial, incendiary",It only takes one person to leave an inflammatory comment on an Internet thread for that thread to blow up into pages upon pages of reader indignation.,None,None,None,None,None,None,BASIC
telling,"https://gre.magoosh.com/flashcards/vocabulary/basic-words-i/telling#back,",adjective: significant and revealing of another factor,Her unbecoming dress was very telling when it came to her sense of fashion.,None,None,None,None,None,None,BASIC
indignant,"https://gre.magoosh.com/flashcards/vocabulary/basic-words-i/indignant#back,",adjective: feeling anger over a perceived injustice,"When the cyclist swerved into traffic, it forced the driver to brake and elicited an indignant shout of ""Hey, punk, watch where you're going!""",None,None,None,None,"Adding to Rizvi!!!!!indignant = in + dig + n + ant; 
while you are busy IN DIGging earth-  expecting treasure, you find an army of ANTs! you will treat them SCORNFULLY and with ANGER.....",INDIGNANT == IGNITE == ANGERED,BASIC
underwrite,"https://gre.magoosh.com/flashcards/vocabulary/basic-words-i/underwrite#back,",verb: to support financially,The latest symphony broadcast was made possible with underwriting from the Carnegie Endowment.,None,None,None,None,"UNDER an agreement, u WRITE ur signature, which is like a guarantee..",None,BASIC
bleak,"https://gre.magoosh.com/flashcards/vocabulary/basic-words-i/bleak#back,",adjective: having a depressing or gloomy outlook,Unremitting overcast skies tend to lead people to create bleak literature and lugubrious music — compare England’s band Radiohead to any band from Southern California.,None,None,None,None,"Bleak sounds like leak, when someone leak urine in his pants he feels cold and cheerless","when exitement leaks we get bleak, means cheerless or cold",BASIC
mesmerize,"https://gre.magoosh.com/flashcards/vocabulary/basic-words-i/mesmerize#back,",verb: to spellbind or enthrall,"The plot and the characters were so well developed that many viewers were mesmerized, unable to move their eyes from the screen for even a single second.",None,None,None,None,mess memory,sounds like memorizeâ€”if you memorize all vocab words you can ATTRACT(HYPNOTIZE) any girl with your good communication skills,BASIC
insolvent,"https://gre.magoosh.com/flashcards/vocabulary/basic-words-i/insolvent#back,",adjective: unable to pay one's bills; bankrupt,"With credit card bills skyrocketing, a shockingly large number of Americans are truly insolvent.",None,None,None,None,in + solvent = one who cant solve his debts.,solvent = person capable of dissolving (solvent dissolves the solute--problems) the issues (by money) while insolvent is the opposite of this.,BASIC
miser,"https://gre.magoosh.com/flashcards/vocabulary/basic-words-i/miser#back,",noun: a person who doesn't like to spend money (because they are greedy),"Monte was no miser, but was simply frugal, wisely spending the little that he earned.",None,None,None,None,None,None,BASIC
erratic,"https://gre.magoosh.com/flashcards/vocabulary/basic-words-i/erratic#back,",adjective: unpredictable; strange and unconventional,"It came as no surprise to pundits that the President’s attempt at re-election floundered; even during his term, support for his policies was erratic, with an approval rating jumping anywhere from 30 to 60 percent.",None,None,None,None,"focus on ERR + atic..part of it,  and err is nothing but ERROR, and errors always look ODD, AND ARE unpredictable in nature.","sounds much similar
to word erotic.....the acts in erotic scenes in movies are quite
unpredictable",BASIC
dog,"https://gre.magoosh.com/flashcards/vocabulary/basic-words-i/dog#back,",verb: to pursue relentlessly; to hound,"Throughout his life, he was dogged by insecurities that inhibited personal growth.",None,None,None,None,None,None,BASIC
indigenous,"https://gre.magoosh.com/flashcards/vocabulary/basic-words-i/indigenous#back,",adjective: originating in a certain area,The plants and animals indigenous to Australia are notably different from those indigenous to the U.S—one look at a duckbill platypus and you know you’re not dealing with an opossum.,None,None,None,None,indian+geniuses.....native or local talent or genius....,None,BASIC
variance,"https://gre.magoosh.com/flashcards/vocabulary/basic-words-i/variance#back,",noun: the quality of being different,"The cynic quipped, “There is not much variance in politicians; they all seem to lie”.",None,None,None,None,None,None,BASIC
spendthrift,"https://gre.magoosh.com/flashcards/vocabulary/basic-words-i/spendthrift#back,",noun: one who spends money extravagantly,"Taking weekly trips to Vegas, Megan was a spendthrift whose excesses eventually caught up to her.",None,None,None,None,"Spendthrift is actually a misnomer...split it as SPEND+THRIFT. Thrifty means, careful use of resources, so a spendthrift should actually mean someone who carefully spends money, but it means SOMEONE WHO WASTES MONEY.",Spend+thirst=Some1 who is thirsty for spending money,BASIC
thrifty,"https://gre.magoosh.com/flashcards/vocabulary/basic-words-i/thrifty#back,",adjective: spending money wisely,"He was economical, spending his money thriftily and on items considered essential.",None,None,None,None,Thrifty and Safety go hand in hand. It is for our own safety to be thrifty (to use resources thoughtfully).,THRIFTY=RUPEES+50...Carefull about that money,BASIC
acme,"https://gre.magoosh.com/flashcards/vocabulary/basic-words-i/acme#back,",noun: the highest point of achievement,"The new Cessna airplanes will be the acme of comfort, offering reclining seats and ample legroom.",None,None,None,None,Like acne=high points on skin(pimple).Acme=Highest point in ones work.,"in cartoon network the coyote uses ACME tools to kill the road runner.... jus remember he always falls off the PEAK of a mountain.,, always",BASIC
tender,"https://gre.magoosh.com/flashcards/vocabulary/basic-words-i/tender#back,",verb: offer up something formally,The government was loath to tender more money in the fear that it might set off inflation.,None,None,None,None,the method of contracting.. or FORMALLY OFFERING a company to undertake public works is called a TENDER....,Tender and Retire. You tender your resignation to retire from your job.,BASIC
indict,"https://gre.magoosh.com/flashcards/vocabulary/basic-words-i/indict#back,",verb: to formally charge or accuse of wrong-doing,"The bankrobber was indicted on several major charges, including possession of a firearm.",None,None,None,None,sorry for the bad language :( but will make you learn the word : if you push your dick in a girl without her permission she will accuse you of rape,Rhymes with VERDICT,BASIC
demean,"https://gre.magoosh.com/flashcards/vocabulary/basic-words-i/demean#back,",verb: to insult; to cause someone to lose dignity or respect,"At first the soccer players bantered back and forth, but as soon as one of the players became demeaning, calling the other's mother a water buffalo, the ref whipped out a red card.",None,None,None,None,it could be interfered as we are 'de'creasing the 'mean'ing of something,demean-> the(de) Mean folks are humiliated and degraded.,BASIC
stipend,"https://gre.magoosh.com/flashcards/vocabulary/basic-words-i/stipend#back,",noun: a regular allowance (of money),"He was hoping for a monthly allowance loan from the government, but after no such stipend was forthcoming he realized he would have to seek other means of paying for his college tuition.",None,None,None,None,Stipend: rhymes with stri-fund.,imagine sum1 paying money to a prostitute to STRIP on a regular basis..,BASIC
