word,wordURL,meaning_1,sentence_1,meaning_2,sentence_2,meaning_3,sentence_3,way_to_remember,way_to_remember2,difficulty
renege,"https://gre.magoosh.com/flashcards/vocabulary/basic-words-3/renege#back,",verb: fail to fulfill a promise or obligation,We will no longer work with that vendor since it has reneged on nearly every agreement.,None,None,None,None,"renege : made of re+nege nege is a root for negative, go negative on ones own said words, which is the meaning.",renege seems lke rehne de.. so rehne de promise mat kar coz i the end you will renege it or sumthng,BASIC
morose,"https://gre.magoosh.com/flashcards/vocabulary/basic-words-3/morose#back,",adjective: ill-tempered and not inclined to talk; gloomy,"After Stanley found out he was no longer able to go on vacation with his friends, he sat in his room morosely.",None,None,None,None,in hindi it is like MOR(peacock) RO(weep) SA raha hai-means it is in sorrow and hence brooding ill humoured,A guy gave a crushed(MOroda hua(Hindi)) ROSE to girl as a humor she got pissed on this ill humor at the guy and canceled the plan of party(unsociable),BASIC
fete,"https://gre.magoosh.com/flashcards/vocabulary/basic-words-3/fete#back,",verb: to celebrate a person,"After World War II, war heroes were feted at first but quickly forgotten.",None,None,None,None,sounds as feat(fete) which means accomplishment....sowe can say...after a glorious feat we do  fete,I bought a new ford FIESTA (sounds like fete) so I am celebrating,BASIC
jocular,"https://gre.magoosh.com/flashcards/vocabulary/basic-words-3/jocular#back,",adjective: characterized by jokes and good humor,"My uncle was always in a jocular mood at family gatherings, messing up people's hair and telling knock-knock jokes to anyone who would listen.",None,None,None,None,joker,Joke(joc) + cooler (cular). Imagine a cooler which throws out jokes. (jocular = said or done as a joke),BASIC
resolve,"https://gre.magoosh.com/flashcards/vocabulary/basic-words-3/resolve#back,",verb: reach a conclusion after a discussion or deliberation,"After much thought, Ted resolved not to travel abroad this summer because he didn't have much money in his bank account.",None,None,None,None,"If u r SOLVING problems in a chapter AGAIN & AGAIN
then u have determination to do that chapter in exams",None,BASIC
fledgling,"https://gre.magoosh.com/flashcards/vocabulary/basic-words-3/fledgling#back,","adjective: young and inexperienced
noun: any new participant in some activity","Murray has years of experience in family practice, but he is just a fledgling in surgery.",None,None,None,None,"sounds similar to sledging in cricket...
normally inexperience young players if unable to get wickets than do sledging..
hope this ll help",rhymes with duckling.. a young duck thus referring to inexperience.,BASIC
patronize,"https://gre.magoosh.com/flashcards/vocabulary/basic-words-3/patronize#back,",verb: treat condescendingly,"She says she genuinely wanted to help me, but instead she patronized me, constantly pointing out how I was inferior to her.",None,None,None,None,PATRO(father)+NIZE(nice)....we get NICE SUPPORT from our FATHER,If u remember Patronus--from latin it will give u a lot of words like patriarch (Patri+ arch: ruled by father or eldest male) well you father is giving u regular pat (encouragement),BASIC
quandary,"https://gre.magoosh.com/flashcards/vocabulary/basic-words-3/quandary#back,",noun: state of uncertainty or perplexity especially as requiring a choice between equally unfavorable options,"Steve certainly is in a quandary: if he doesn't call Elaine, she will blame him for everything, but if he does call her, the evidence of where he currently is could cost him his job.",None,None,None,None,"quantary relates to quantum physics,which is so complex that it leaves you in DILEMMA about the UNCERTAINITY of photon",this word quandary sounds like wandering so if you are in a DILEMMA you wander all around the streets.....,BASIC
archaic,"https://gre.magoosh.com/flashcards/vocabulary/basic-words-3/archaic#back,",adjective: so old as to appear to belong to a different period,"Hoping to sound intelligent, Mary spoke in archaic English that was right out of Jane Austen's Pride and Prejudice--needless to say, she didn't have many friends.",None,None,None,None,Archealogy - study of old things.. Archaic - The old things on which we study..,The word resembles like archies ...the old archies card are kept with us.,BASIC
ornate,"https://gre.magoosh.com/flashcards/vocabulary/basic-words-3/ornate#back,",adjective: marked by elaborate rhetoric and elaborated with decorative details,The ornate Victorian and Edwardian homes spread throughout San Francisco are my favorite part of the city.,None,None,None,None,"sounds like ORNAmenTe ..when many ornaments are used, the thing is ornated.",None,BASIC
disheartened,"https://gre.magoosh.com/flashcards/vocabulary/basic-words-3/disheartened#back,",adjective: made less hopeful or enthusiastic,"After the visiting team scored nine times, the home team's fans were disheartened, some leaving the game early.",None,None,None,None,None,None,BASIC
meander,"https://gre.magoosh.com/flashcards/vocabulary/basic-words-3/meander#back,",verb: to wander aimlessly,"A casual observer might have thought that Peter was meandering through the city, but that day he was actually seeking out those places where he and his long lost love had once visited.",None,None,None,None,Pronounce it like 'wander'; they are synonymous.,when pronounced GIVE THE sounds OF meAN+wANDER.....SO A MEAN PERSON always WANDER aimlessly.,BASIC
autonomously,"https://gre.magoosh.com/flashcards/vocabulary/basic-words-3/autonomously#back,",adverb: Acting independently; self-governing (of a country),Many of the factory workers are worried about being replaced by machines and computers that will work completely autonomously.,None,None,None,None,None,None,BASIC
ingenuity,"https://gre.magoosh.com/flashcards/vocabulary/basic-words-3/ingenuity#back,",noun: the power of creative imagination,"Daedalus was famous for his ingenuity; he was able to fashion his son Icarus with a pair of wings, using wax to hold them together.",None,None,None,None,"ingen.. can be related to an ""engine"" which is a clever or skillful work",Ingenuity-In(not)-genuity(genuine):Not really genuine...hence using cleverness and smartness with cunning attitude,BASIC
apprehension,"https://gre.magoosh.com/flashcards/vocabulary/basic-words-3/apprehension#back,",noun: fearful expectation,"Test day can be one of pure apprehension, as many students worry about their test scores.",None,None,None,None,None,None,BASIC
ascendancy,"https://gre.magoosh.com/flashcards/vocabulary/basic-words-3/ascendancy#back,",noun: the state that exists when one person or group has power over another,The ascendancy of the Carlsbad water polo team is clear—they have a decade of championships behind them.,None,None,None,None,"Ascend means to rise... as u rise, u always gain power...& den u dance :p",ascendancy... wife has ascendancy over her husband...she make him dance to her tune !,BASIC
incessant,"https://gre.magoosh.com/flashcards/vocabulary/basic-words-3/incessant#back,",adjective: uninterrupted in time and indefinitely long continuing,"I don't mind small children in brief doses, but I think the incessant exposure that their parents have to them would quickly wear me down.",None,None,None,None,"IN(MEANS not)+cessa(sounds like CEASE (MEANS TO STOP)...something which does not stop , and continues forever, hence UNINTERRUPTED AND UNCEASING.",the meeting is IN SESSION and it may never end.,BASIC
transitory,"https://gre.magoosh.com/flashcards/vocabulary/basic-words-3/transitory#back,",adjective: lasting a very short time,"If we lived forever and life was not transitory, do you think we would appreciate life less or more?",None,None,None,None,Transistors take a very short time to turn from on to off i.e acting like a switch,"Or, transitory=transition will occur(it has tendency for it)..so, it'll stay in the previous state for short period..previous state is ephemeral..",BASIC
inclement,"https://gre.magoosh.com/flashcards/vocabulary/basic-words-3/inclement#back,","adjective: (of weather) unpleasant, stormy","After a week of inclement weather, we finally are able to go outside and enjoy the sun.",adjective: used of persons or behavior; showing no mercy,"Marcus Aurelius, though a fair man, was inclement to Christians during his reign, persecuting them violently.",None,None,"clemen(t)cy means kind, while inclement means unkind, rude,(for a person) stormy(for weather).",bosses are always incleament when theres time of increament,BASIC
moot,"https://gre.magoosh.com/flashcards/vocabulary/basic-words-3/moot#back,",adjective: open to argument or debate; undecidable in a meaningless or irrelevant way,"Since the Board just terminated Steve as the CEO, what the finance committee might have thought of his proposed marketing plan for next year is now a moot point.",None,None,None,None,Jhoot moot. Law students were arguing on a jhoot moot ka topic.,None,BASIC
muted,"https://gre.magoosh.com/flashcards/vocabulary/basic-words-3/muted#back,","adjective: softened, subdued","Helen preferred muted earth colors, such as green and brown, to the bright pinks and red her sister liked.",None,None,None,None,None,None,BASIC
endemic,"https://gre.magoosh.com/flashcards/vocabulary/basic-words-3/endemic#back,",adjective: native; originating where it is found,"Irish cuisine makes great use of potatoes, but ironically, the potato is not endemic to Ireland.",None,None,None,None,simple think of epidemic as an epidemic desease that spreads a vast area and endemic disease as a disease that spreads only a confined area,epidemic is something that is confined to vast area and endemic is confined to small area,BASIC
obdurate,"https://gre.magoosh.com/flashcards/vocabulary/basic-words-3/obdurate#back,",adjective: unable to be persuaded or moved emotionally; stubborn; unyielding.,No number of pleas and bribes would get him to change his obdurate attitude.,None,None,None,None,"OB+DURA(RELATE IT TO WORD DURABILITY)..SO anything which has durability..has the resisting power, and something which can resist, is stubborn.","OB+DU+RATE  realate it as AB(OB) RATE DoUble ho gaya,and the seller was very STUBBORN about that",BASIC
guffaw,"https://gre.magoosh.com/flashcards/vocabulary/basic-words-3/guffaw#back,",verb: laugh boisterously,"Whenever the jester fell to the ground in mock pain, the king guffawed, exposing his yellow, fang-like teeth.",None,None,None,None,"remember gufa in hindi. If you laugh a bit in gufa, it sounds like boisterous laugh.","rhymes with gappa or gappe(hindi)...jab log gappe marte hein, this is  when there is boisterous laughter all around ....I know its a way too dumb....",BASIC
boon,"https://gre.magoosh.com/flashcards/vocabulary/basic-words-3/boon#back,",noun: a desirable state,Modern technology has been a boon to the travel industry.,adjective: very close and convivial,"He was a boon companion to many, and will be sadly missed.",None,None,boon - bonus - something helpful,Remember David BOON who was blessing for cricket,BASIC
impede,"https://gre.magoosh.com/flashcards/vocabulary/basic-words-3/impede#back,",verb: be a hindrance or obstacle to,"Since the police sergeant had to train the pair of new hires, progress in his own case was impeded.",None,None,None,None,impede from impedance meaning resistance,Ped (Tree in hindi)on the way.....,BASIC
advocate,"https://gre.magoosh.com/flashcards/vocabulary/basic-words-3/advocate#back,","verb: speak, plead, or argue in favor of","While the senator privately approved of gay marriage, he was unwilling to advocate for the cause in a public venue.",noun: a person who pleads for a cause or propounds an idea,Martin Luther King Jr. was a tireless advocate for the rights of African-Americans in the United States. ,None,None,"advocate...advocate usually ""urges""or ""pleads"" judge to give in his favour",advocate: add+ur VOICE ...support,BASIC
dearth,"https://gre.magoosh.com/flashcards/vocabulary/basic-words-3/dearth#back,",noun: a lack or shortage,I am surprised by the dearth of fast food chains; this is America and I assumed they were on every street.,None,None,None,None,earth is big. de-earth.....(read as dearth) means small...small in quantity..or scarcity,dearth sounds like death. high death rate can result in scarcity of man-power,BASIC
elusive,"https://gre.magoosh.com/flashcards/vocabulary/basic-words-3/elusive#back,",adjective: difficult to capture or difficult to remember,Many first time skydivers say that describing the act of falling from the sky is elusive.,None,None,None,None,illusive things are always difficult to understand,"elusive is like exclusive,,, and exclusive content is hard to get!",BASIC
appreciable,"https://gre.magoosh.com/flashcards/vocabulary/basic-words-3/appreciable#back,",adjective: large enough to be noticed (usu. refers to an amount),There is an appreciable difference between those who say they can get the job done and those who actually get the job done.,None,None,None,None,APPRECIABLE sounds like PERCEPTIBLE.,None,BASIC
snide,"https://gre.magoosh.com/flashcards/vocabulary/basic-words-3/snide#back,",adjective: expressive of contempt; derogatory or mocking in an indirect way,"The chairman interpreted Taylor's question about promotions as a snide remark, but in all innocence Taylor was trying to figure out the company's process.",None,None,None,None,snide ante maccha,If the guys are nude in the streets.They will be disrespested.,BASIC
discriminate,"https://gre.magoosh.com/flashcards/vocabulary/basic-words-3/discriminate#back,",verb: recognize or perceive the difference,"Sarah couldn't discriminate between a good wine and a bad wine, so she avoided wine tastings.",None,None,None,None,"""discri"" + ""minate"" = ""describe in one minute"" when someone can describe something in one minute he can distinguish that.",dis(apart)+criminal,BASIC
disenfranchise,"https://gre.magoosh.com/flashcards/vocabulary/basic-words-3/disenfranchise#back,",verb: deprive of voting rights,The U.S. Constitution disenfranchised women until 1920 when they were given the right to vote.,None,None,None,None,Franchise' means right to freedom .. disFranchise means restricted freedom.. deprived of voting!,IPL franchisee ne to players ke civil right bhi chhin liye hain,BASIC
deter,"https://gre.magoosh.com/flashcards/vocabulary/basic-words-3/deter#back,",verb: turn away from by persuasion,"His mother tried to deter him from joining the army, but he was too intoxicated with the idea of war to listen.",verb: try to prevent; show opposition to,"The government's primary job should involve deterring paths to war, not finding ways to start them.",None,None,DExTER (cartoon character) used to PREVENT her sister from coming in his secret laboratory,DETERgent prevents dirt,BASIC
entice,"https://gre.magoosh.com/flashcards/vocabulary/basic-words-3/entice#back,",verb: get someone to do something through (often false or exaggerated) promises,"Harold enticed his wife, Maude, to go on a vacation to Hawaii, with promises of luaus on the beach and all-you-can-eat seafood buffets.",None,None,None,None,Everyone got so  ATTRACTED to the ENTICEr bike that they were TEMPTED to buy it..,Rhymes with MICE.A bait is used to entice a MICE,BASIC
avid,"https://gre.magoosh.com/flashcards/vocabulary/basic-words-3/avid#back,",adjective: marked by active interest and enthusiasm,"Martin is an avid birdwatcher, often taking long hikes into remote mountains to see some rare eagle.",None,None,None,None,a person is always eager to be in  avid(a video),drAVID (Rahul dravid) is greedy for runs,BASIC
consummate,"https://gre.magoosh.com/flashcards/vocabulary/basic-words-3/consummate#back,",adjective: having or revealing supreme mastery or skill,"Tyler was the consummate musician: he was able to play the guitar, harmonica, and the drum at the same time.",verb: to make perfect and complete in every respect,The restoration of the ancient church was only consummated after a twenty years of labor.,None,None,"if you want to consume your mate(wife), you have to be complete 'a complete man- raymonds :P'","con+summit(....the highest point of something)....and now imagine a person who has reached the highest point of perfection,is truly a complete man.",BASIC
respite,"https://gre.magoosh.com/flashcards/vocabulary/basic-words-3/respite#back,",noun: a pause from doing something (as work),"Every afternoon, the small company has a respite in which workers play foosball or board games.",None,None,None,None,Tarik pe Tarik (Sunny Deol) Respite pe Respite,rest a bit,BASIC
proponent,"https://gre.magoosh.com/flashcards/vocabulary/basic-words-3/proponent#back,",noun: a person who pleads for a cause or propounds an idea,"Ironically, the leading proponent of Flat-Earth Theory flies all over the world in an effort to win more adherents.",None,None,None,None,person opposite to opponent,"PePsOdENT is proponent for me,it really fights from all teeth problem.",BASIC
plodding,"https://gre.magoosh.com/flashcards/vocabulary/basic-words-3/plodding#back,",adjective: (of movement) slow and laborious,"Charlie may seem to run at a plodding pace, but he is an ultramarathoner, meaning he runs distances of up to 100 miles, and can run for ten hours at a stretch.",None,None,None,None,think of PLOTTING which moves slowly,"it sounds like applaud ; implies to come & collect prize , we walk plodding while applauding",BASIC
robust,"https://gre.magoosh.com/flashcards/vocabulary/basic-words-3/robust#back,","adjective: sturdy and strong in form, constitution, or construction","Chris preferred bland and mild beers, but Bhavin preferred a beer with more robust flavor.",None,None,None,None,"like a robot  >>sturdy & strong
POWERFUL, MUSCULAR, VIGOROUS",bust of a gal is strong..its soft actually but think opp guys..!!...no personal offense..the more vulgar the better yu grasp..!!...my way !! :),BASIC
degrade,"https://gre.magoosh.com/flashcards/vocabulary/basic-words-3/degrade#back,","verb: reduce in worth or character, usually verbally","Jesse had mockingly pointed out all of Nancy's faults in front of their friends, publicly degrading the poor girl.",None,None,None,None,de(belittle)+grade,None,BASIC
impermeable,"https://gre.magoosh.com/flashcards/vocabulary/basic-words-3/impermeable#back,",adjective: does not allow fluids to pass through,"The sand bags placed on the river formed an impermeable barrier, protecting the town from flooding.",None,None,None,None,im(no)+permeable(permission)that means no permission for seepage.,Permeable membrane allows fluid to pass thru .... so 'impermeable' that does not allow through ...,BASIC
malleable,"https://gre.magoosh.com/flashcards/vocabulary/basic-words-3/malleable#back,",adjective: capable of being shaped or bent or drawn out,The clay became malleable and easy to work with after a little water was added.,adjective: easily influenced,My little brother is so malleable that I can convince him to sneak cookies from the cupboard for me.,None,None,relate with meltable; so possible to reshape,Many women believe they can mold their MALE (malle) partners into ABLE-bodied husbands.,BASIC
stolid,"https://gre.magoosh.com/flashcards/vocabulary/basic-words-3/stolid#back,",adjective: having or revealing little emotion or sensibility; not easily aroused or excited,"Elephants may appear stolid to casual observers, but they actually have passionate emotional lives.",None,None,None,None,"stone like
It becomes 'T' SOLID. So someone very SOLID against 'T'(ears) or emo'T'ions.","STOL(sounds like stool)..and a stool is a nonliving thing without any emotion,simillarly a STOLID is like stool without any emotion,always dull and boring.",BASIC
raffish,"https://gre.magoosh.com/flashcards/vocabulary/basic-words-3/raffish#back,",adjective: marked by a carefree unconventionality or disreputableness,"The men found him raffish, but the women adored his smart clothes and casual attitude.",None,None,None,None,"sounds like ""rough""ish so somthing which is rough in behaviour, that reminds of youngsters and they are carefree",RAFFISH = ROUGHISH. YOUNGSTERS THINK IT IS STYLISH OTHERS THINK IT AS VULGAR. SO VULGAR/STYLISH,BASIC
thwart,"https://gre.magoosh.com/flashcards/vocabulary/basic-words-3/thwart#back,","verb: hinder or prevent (the efforts, plans, or desires) of","I wanted to spend a week in New York this autumn, but the high costs of travel and lodging thwarted my plans.",None,None,None,None,this word sounds like THROAT....so if someone squeezes your throat your air passages will get blocked...............thus desires will be prevented.. u also feel frustrated and baffled..,Thwart or Obstruct is to prevent someone from doing something.,BASIC
pithy,"https://gre.magoosh.com/flashcards/vocabulary/basic-words-3/pithy#back,",adjective: concise and full of meaning,I enjoy reading the Daodejing for its pithy and insightful prose; it always gives me something to think about.,None,None,None,None,pi-thy: the math symbol pi is concise and has great meaning,"pithy : pithaj+y=pithaji,he should be very precise and brief",BASIC
malady,"https://gre.magoosh.com/flashcards/vocabulary/basic-words-3/malady#back,",noun: a disease or sickness,The town was struck by a malady throughout the winter that left most people sick in bed for two weeks.,None,None,None,None,mala D is a pill ( contraceptive ):: and you take pills when you become ill.,Malaria is a type of malady,BASIC
flounder,"https://gre.magoosh.com/flashcards/vocabulary/basic-words-3/flounder#back,",verb: behave awkwardly; have difficulties,"Sylvia has excelled at advanced calculus, but ironically, when she has to deal with taxes, she flounders.",None,None,None,None,Fly+under water is accompanied with lots of struggle and confusion,Sounds similar to founder.. a startup founder has to face lots of difficulties in the beginning.,BASIC
impeccable,"https://gre.magoosh.com/flashcards/vocabulary/basic-words-4/impeccable#back,",adjective: without fault or error,He was impeccably dressed in the latest fashion without a single crease or stain.,None,None,None,None,im+pecca(pakka.it was there in our science book in class 2)...pakka house is always faultless as compared to kutchcha house.,"Picking on somebody means to finding faults. Hence Im Pickable means, no fault can be found",BASIC
precedent,"https://gre.magoosh.com/flashcards/vocabulary/basic-words-4/precedent#back,",noun: an example that is used to justify similar occurrences at a later time,"The principal explained that even though one student had done modelling work outside of school, the outfits that student wore in those photographs in no way established a precedent for what could be worn at school dances.",None,None,None,None,"precedent == pre(before)+ cedent(incedent), an incident happened before which will decide the following incedent.",precedent = PRECEDE + eveNT. an event that preceds (comes before),BASIC
spurn,"https://gre.magoosh.com/flashcards/vocabulary/basic-words-4/spurn#back,",verb: reject with contempt,"She spurned all his flattery and proposals, and so he walked off embarrassed and sad.",None,None,None,None,"Spurn = s + purn. S = sex!!
Purn = porn ; we disdainfully reject ""sex + porn""","spur is to give heart to i.e., help.

spurn is to reject help.",BASIC
conducive,"https://gre.magoosh.com/flashcards/vocabulary/basic-words-4/conducive#back,",adjective: making a situation or outcome more likely to happen,Studying in a quiet room is conducive to learning; studying in a noisy environment makes learning more difficult.,None,None,None,None,conducive - come(con) + do(du) + civil work(cive).....doing civil work is helpful & contributive.,"Conducive sounds like conductive. Conductivity, property of a metal, means passing electricity smoothly, i.e. helpfull in making it pass..so, conducive means helpful or favoring.",BASIC
fickle,"https://gre.magoosh.com/flashcards/vocabulary/basic-words-4/fickle#back,","adjective: liable to sudden unpredictable change, esp. in affections or attachments","She was so fickle in her politics, it was hard to pinpoint her beliefs; one week she would embrace a side, and the next week she would denounce it.",None,None,None,None,imagine you are in a grocery shop. you need to select a PICKLE bottle . there are so many varieties of pickle there so ur FICKLE (changing mind) about which one to buy,you tickle your gf and she kicks you hard at the main point... you start to doubt if she is faithless and changeable... lol,BASIC
egotist,"https://gre.magoosh.com/flashcards/vocabulary/basic-words-4/egotist#back,",noun: a conceited and self-centered person,"An egotist, Natasha had few friends because of her inability to talk about anything except her dream of becoming the next American Idol.",None,None,None,None,None,None,BASIC
smattering,"https://gre.magoosh.com/flashcards/vocabulary/basic-words-4/smattering#back,",noun: a slight or superficial understanding of a subject; a small amount of something,"I know only a smattering of German, but Helen is able to read German newspapers and converse with natives.",None,None,None,None,"He does not know the actual matter. His knowledge is quite smattering.
smattering=small matter talk.",SMATTER has only SOME MATTER.. thus has only superficial knowledge.. :),BASIC
hamstrung,"https://gre.magoosh.com/flashcards/vocabulary/basic-words-4/hamstrung#back,",verb: made ineffective or powerless,"The FBI has made so many restrictions on the local police that they are absolutely hamstrung, unable to accomplish anything.",None,None,None,None,None,None,BASIC
